date,region,type,label,score,tags,link
2025-09-22,unknown,PLAYER_BURST,Así va la tabla de posiciones del Sudamericano Sub-20,84.2,CONMEBOL|esordio|prestazioni|youth,https://www.infobae.com/colombia/deportes/2025/02/05/que-le-hace-falta-a-la-seleccion-colombia-para-clasificar-al-mundial-asi-va-la-tabla-de-posiciones-del-sudamericano-sub-20/
2025-09-22,unknown,TRANSFER_SIGNAL,Transferencias de Préstamo en el Fútbol: ¿Que Son? ¿Como ...,73.5,mercato|youth,https://obt.1b6.myftpupload.com/2023/03/10/transferencias-de-prestamo-en-el-futbol-que-son-como-funcionan-quien-esta-implicado/
2025-09-22,unknown,PLAYER_BURST,Fútbol: Conoce a las joyas del futuro de Argentina que ...,55.5,CONMEBOL|esordio|prestazioni|youth,https://www.olympics.com/es/noticias/futbol-joyas-jugadores-futuro-argentina-sudamericano-sub-20-2025
2025-09-22,unknown,PLAYER_BURST,El Defensa Jeremy Garay Regresa de Préstamo de El ...,33.4,esordio|mercato|prestazioni|youth,https://www.dcunited.com/news/el-defensa-jeremy-garay-regresa-de-prestamo-de-el-paso-locomotive-fc
2025-09-22,unknown,NOISE_PULSE,Sub-20: No confronto de ida das quartas do Estadual ...,32.42,prestazioni|recente,https://www.cearasc.com/noticia/sub-20-no-confronto-de-ida-das-quartas-do-estadual
2025-09-22,unknown,PLAYER_BURST,FC Desamparados Is the Team with The Most Sub 20 Minutes ...,21.8,esordio|mercato|prestazioni,https://wearefc.club/2022/11/01/fc-desamparados-is-the-team-with-the-most-sub-20-minutes-during-regular-phase/
2025-09-22,unknown,TRANSFER_SIGNAL,El Chicago Fire FC Adquiere al Defensa Portugués Leonardo ...,19.1,mercato|prestazioni|youth,https://www.chicagofirefc.com/news/el-chicago-fire-fc-adquiere-al-defensa-portugues-leonardo-barroso-del-sporting-cp
2025-09-22,unknown,NOISE_PULSE,Venezuela golea y Chile debuta sumando en el Sub-20 ...,17.9,CONMEBOL|prestazioni|recente,https://www.conmebol.com/noticias/venezuela-golea-y-chile-debuta-sumando-en-el-sub-20-femenino/
2025-09-22,unknown,TRANSFER_SIGNAL,Los mejores porteros jóvenes para fichar en el modo ...,8.8,mercato,https://www.si.com/es-us/futbol/los-mejores-porteros-jovenes-para-fichar-en-el-modo-carrera-del-ea-sports-fc-24
2025-09-22,unknown,NOISE_PULSE,Los futbolistas jóvenes del EA Sports FC 25 para fichar en ...,0.0,segnali,https://www.si.com/es-us/futbol/los-futbolistas-jovenes-del-ea-sports-fc-25-para-fichar-en-el-modo-carrera-con-rostro-escaneado
2025-09-18,unknown,NOISE_PULSE,Botafogo estreia nesta quinta-feira contra o Independente-SP,98.6,segnali,https://www.fogaonet.com/noticias-do-botafogo/campeonato-brasileiro-feminino-sub-20-botafogo-estreia-nesta-quinta-feira-contra-o-independente-sp/
2025-09-18,unknown,NOISE_PULSE,"Sul-Americano Sub-20: como funciona, datas, grupos ...",95.7,CONMEBOL|mercato|prestazioni,https://www.365scores.com/pt-br/news/magazine/sul-americano-sub-20/
2025-09-18,unknown,NOISE_PULSE,Dómina debuta en la Sub 20 y se juega el boleto a L'Alcúdia,76.4,CONMEBOL|prestazioni|youth,https://www.ellitoral.com/actualidad-tatengue/jeronimo-domina-union-seleccion-argentina-sub-20-amistoso-internacional-cotif-lalcudia-southampton-premier-league-torneo-sub-20-javier-mascherano-diego-placente_0_FgwKmpTTCC.html
2025-09-18,unknown,PLAYER_BURST,así reflejaron los medios brasileños el 6-0 de Argentina en ...,64.7,CONMEBOL|esordio|prestazioni|youth,https://www.infobae.com/deportes/2025/01/25/humillacion-aplastados-y-la-peor-derrota-de-la-historia-asi-reflejaron-los-medios-brasilenos-el-6-0-de-argentina-en-el-sub-20/
2025-09-18,unknown,PLAYER_BURST,Empieza el Sudamericano Sub 20: cuándo debuta la ...,55.1,CONMEBOL|esordio|recente|youth,https://www.c5n.com/deportes/empieza-el-sudamericano-sub-20-cuando-debuta-la-seleccion-argentina-n188419
2025-09-18,unknown,NOISE_PULSE,Brasil x Argentina Sul-Americano Sub-20 Palpites,52.9,CONMEBOL|prestazioni,https://www.gazetaesportiva.com/apostas/prognosticos/futebol/brasil-x-argentina-sul-americano-sub-20-24-01-2025
2025-09-18,unknown,PLAYER_BURST,"Con Mura, la Selección Sub 20 goleó en el debut mundialista",52.4,CONMEBOL|esordio|prestazioni|youth,https://estudiantesdelaplata.com/con-mura-la-seleccion-sub-20-goleo-en-el-debut-mundialista/
2025-09-18,unknown,PLAYER_BURST,Los 23 elegidos de la selección Argentina para el ...,39.0,CONMEBOL|esordio|recente,https://www.conmebol.com/noticias/los-23-elegidos-de-la-seleccion-argentina-para-el-sudamericano-sub-20/
2025-09-18,unknown,PLAYER_BURST,Argentina se alista para el debut en el Sudamericano Sub20 ...,36.8,CONMEBOL|esordio,https://www.eldiarioweb.com/2025/01/argentina-se-alista-para-el-debut-en-el-sudamericano-sub20-en-venezuela/
2025-09-18,unknown,PLAYER_BURST,San Diego FC adquiere al mediocampista Luca de la Torre ...,32.3,esordio|mercato|prestazioni|youth,https://www.sandiegofc.com/news/san-diego-fc-adquiere-al-mediocampista-luca-de-la-torre-a-prestamo-del-rc-celta-de-vigo
2025-09-17,south-america,NOISE_PULSE,Michael Camejo - Más participaciones de gol en un partido,100.0,CAF|mercato|prestazioni|south-america|youth,https://www.transfermarkt.co/michael-camejo/meistetorbeteiligungen/spieler/1240598
2025-09-17,unknown,PLAYER_BURST,Selección de fútbol sub-20 de Chile,100.0,CONMEBOL|esordio|prestazioni|youth,https://www.wikiwand.com/es/articles/Selecci%C3%B3n_de_f%C3%BAtbol_sub-20_de_Chile
2025-09-17,unknown,PLAYER_BURST,Liga MX: Futbol de Estufa rumbo al Apertura 2025,100.0,CONMEBOL|esordio|mercato|prestazioni|youth,https://espndeportes.espn.com/futbol/mexico/nota/_/id/15090382/liga-mx-futbol-estufa-apertura-2025-rumores-fichajes
2025-09-17,unknown,PLAYER_BURST,Los clasificados del Grupo B,56.31,CONMEBOL|esordio|prestazioni|recente,https://www.conmebol.com/noticias/los-clasificados-del-grupo-b/
2025-09-17,unknown,PLAYER_BURST,Viajaba para sumarse a la Sub 20 y su club le ordenó volver,44.42,esordio|prestazioni|recente|youth,https://www.infobae.com/deportes/2025/09/16/viajaba-para-sumarse-a-la-sub-20-y-su-club-le-ordeno-volver-la-nueva-baja-de-placente-a-12-dias-del-mundial-de-chile/
2025-09-17,unknown,NOISE_PULSE,RJ1 – TV Rio Sul | Equipe sub-20 do Voltaço estreia na Copa ...,21.0,segnali,https://globoplay.globo.com/v/6404018/
2025-09-17,unknown,NOISE_PULSE,"ISAGI, RIN, BAROU Y NAGI - TODOS LOS GOLES Y ...",0.0,js-heavy,https://www.reddit.com/r/BlueLock/comments/17t4k4g/isagi_rin_barou_and_nagi_all_goals_and_assists/?tl=es-es
2025-09-17,unknown,NOISE_PULSE,Vasco alineado para el primer partido sub-20,0.0,js-heavy,https://www.reddit.com/r/vasco/comments/1j9os20/vasco_escalado_para_o_primeiro_jogo_do_sub20/?tl=es-419
2025-09-16,unknown,NOISE_PULSE,"São Paulo Sub-20: Partidos, Resultados y Estadísticas",100.0,prestazioni|youth,https://www.apwin.com/es/equipo/sao-paulo-futebol-clube-under-20/
2025-09-16,unknown,NOISE_PULSE,"Oeste Sub-20: Partidos, Resultados y Estadísticas",100.0,prestazioni|recente|youth,https://www.apwin.com/es/equipo/oeste-futebol-club-under-20/
2025-09-16,unknown,PLAYER_BURST,"Claudio Úbeda, antes del debut del Sub 20: «El modelo de ...",40.5,CONMEBOL|esordio|recente|youth,https://www.conmebol.com/noticias/claudio-ubeda-antes-del-debut-del-sub-20-el-modelo-de-pekerman-es-un-estimulo-y-un-espejo-seguir/
2025-09-16,unknown,PLAYER_BURST,Con presente en la Selección Sub 20: el Inter Miami de ...,39.62,esordio|mercato|prestazioni|recente|youth,https://www.infobae.com/deportes/2025/09/15/con-presente-en-la-seleccion-sub-20-el-inter-miami-de-messi-oficializo-la-llegada-de-un-nuevo-refuerzo/
2025-09-16,unknown,PLAYER_BURST,Argentina empata 2-2 con Panamá en su debut en el ...,31.88,CONMEBOL|esordio|prestazioni|recente,https://www.conmebol.com/noticias/argentina-empata-2-2-con-panama-en-su-debut-en-el-mundial-sub-20/
2025-09-16,unknown,PLAYER_BURST,Cae el Tri en debut en la Copa del Mundo Sub-20 (Video),30.2,esordio|prestazioni,https://www.latimes.com/espanol/deportes/articulo/2019-05-23/hoyla-fut-agrio-debut-del-tri-en-mundial-sub-20-italia
2025-09-16,unknown,PLAYER_BURST,"Gambeta, giro y potente remate: el golazo de Nico Paz en ...",28.92,esordio|mercato|prestazioni|recente|youth,https://www.infobae.com/deportes/2025/09/15/gambeta-giro-y-potente-remate-el-golazo-de-nico-paz-en-el-empate-del-como-frente-al-genoa/
2025-09-16,unknown,NOISE_PULSE,Trabajos de Futbolista en clubes con nuestra bolsa ...,11.12,mercato|prestazioni|recente,https://futboljobs.com/bolsa-empleo-futbol/jugadores/?srsltid=AfmBOop8X7sNEgxqTRUAhnR18hMn7vP135eaxBoe150uj-w4YSilqD8U
2025-09-15,unknown,PLAYER_BURST,Calificaciones de los grandes traspasos del verano,100.0,esordio|mercato|prestazioni,https://espndeportes.espn.com/futbol/nota/_/id/15341829/mercado-fichajes-europa-calificaciones-transferencias-traspasos-valor
2025-09-15,unknown,PLAYER_BURST,Fútbol: todo listo para el debut de Israel en el Sub 20 de ...,82.9,CONMEBOL|esordio|prestazioni|youth,https://www.israeleconomico.com/deportes/todo-listo-para-el-debut-de-israel-ante-colombia-en-el-sub-20-de-argentina/
2025-09-15,unknown,TRANSFER_SIGNAL,"Mercado de fichajes hoy, en directo | Altas, bajas y última ...",80.78,CONMEBOL|mercato|prestazioni|youth,https://www.marca.com/futbol/mercado-fichajes/2025/07/01/68638a9a7aeb1c2f7508bc47-directo.html
2025-09-15,unknown,PLAYER_BURST,Alemania se quita la espina del debut y golean a Nueva ...,67.5,esordio|prestazioni,https://www.tudn.com/futbol/resumen-sub-20-alemania-se-quita-la-espina-del-debut-y-golean-a-nueva-zelanda-video
2025-09-15,unknown,NOISE_PULSE,Sub-20: Ceará encara o Falcon/SE na estreia na Copa do ...,40.6,segnali,https://www.cearasc.com/noticia/sub-20-ceara-encara-o-falconse-na-estreia-na-copa-
2025-09-15,unknown,PLAYER_BURST,DEBUT DE ENSUEÑO PARA PUERTO RICO ANTE ...,27.8,esordio|prestazioni,https://fpfpuertorico.com/debut-de-ensueno-para-puerto-rico-ante-dominicana/
2025-09-15,unknown,PLAYER_BURST,Universitario cayó ante Belgrano en su debut en la Copa ...,12.5,esordio|prestazioni,https://espndeportes.espn.com/futbol/copa-libertadores/nota/_/id/14867509/universitario-cayo-ante-belgrano-en-su-debut-sub20
2025-09-15,unknown,NOISE_PULSE,Trabajos de Futbolista en clubes con nuestra bolsa ...,9.52,mercato|recente,https://futboljobs.com/bolsa-empleo-futbol/jugadores/?srsltid=AfmBOoo9R245s5yrFe6IHnvQicVa1Wx41TAVfY8jvDWCLxRUZvFIMTEz
2025-09-15,unknown,NOISE_PULSE,[Resumo e Discussão de Transferências] Verão de 2025,0.0,js-heavy,https://www.reddit.com/r/reddevils/comments/1my60bf/transfer_round_up_discussion_summer_2025/?tl=pt-br
2025-09-15,unknown,NOISE_PULSE,Comentario Del Reglamento Sobre El Estatuto y La ...,0.0,segnali,https://es.scribd.com/document/855429951/Comentario-Del-Reglamento-Sobre-El-Estatuto-y-La-Transferencia-de-Los-Jugadores
2025-09-14,unknown,NOISE_PULSE,MUNDIAL SUB 20 CHILE 2025: ESTAS SON LAS FIGURAS ...,70.65,CONMEBOL|prestazioni|recente|youth,https://sportsmedia.games/2025/09/12/mundial-sub-20-chile-2025-estas-son-las-figuras-ausentes-en-el-torneo/
2025-09-14,unknown,PLAYER_BURST,Los convocados a la Selección Sub-20 antes del Mundial,68.05,CONMEBOL|esordio|recente,https://santafedeportivo.com/2025/09/12/los-convocados-a-la-seleccion-sub-20-antes-del-mundial-que-pasara-con-los-del-exterior-y-los-que-juegan-copas/
2025-09-14,unknown,PLAYER_BURST,La Albirroja arranca con el pie derecho,67.99,CONMEBOL|esordio|prestazioni|recente,https://www.conmebol.com/noticias/la-albirroja-arranca-con-el-pie-derecho/
2025-09-14,unknown,NOISE_PULSE,Estrella Joven de RSL Diego Luna Lleva a la Selección ...,45.5,prestazioni|youth,https://www.rsl.com/news/estrella-joven-de-rsl-diego-luna-lleva-a-la-seleccion-nacional-juvenil-masculina
2025-09-14,unknown,NOISE_PULSE,Tabla de posiciones Sudamericano sub 20: Estadisticas ...,16.4,CONMEBOL|prestazioni,https://www.futbolred.com/tabla-de-posiciones/sudamericano-sub-20
2025-09-14,unknown,TRANSFER_SIGNAL,Fichaje de Ahmed Abdullahi: Sunderland a Angers SCO,14.8,mercato|youth,https://www.transferfeed.com/es/fichajes/ahmed-abdullahi-sunderland-angers-sco/16615152
2025-09-14,unknown,TRANSFER_SIGNAL,Delantero chileno sub 20 debutó con un hat-trick en Cuiabá,14.5,prestazioni,https://onefootball.com/pt-br/noticias/delantero-chileno-sub-20-debuto-con-un-hat-trick-en-cuiaba-llego-hace-dos-dias-a-brasil-41477997
2025-09-14,unknown,NOISE_PULSE,La Sub 20 de Uruguay debutó en el Torneo de L'Alcudia ...,12.4,prestazioni,https://espndeportes.espn.com/futbol/mundial/nota/_/id/13939737/triunfo-uruguay-sub-20-elche-fabian-coito-torneo-lalcudia
2025-09-14,unknown,TRANSFER_SIGNAL,Fichaje de Kayke: Botafogo a Fortaleza,12.1,mercato|prestazioni|youth,https://www.transferfeed.com/es/fichajes/kayke-botafogo-fortaleza/16615073
2025-09-13,unknown,NOISE_PULSE,"Paraguay Sub 20 Resultados, estadísticas y highlights",75.4,CONMEBOL|prestazioni|youth,https://espndeportes.espn.com/futbol/equipo/_/id/10296/paraguay-sub-20
2025-09-13,unknown,TRANSFER_SIGNAL,"Mercado de fichajes hoy, en directo | Altas, bajas y última ...",74.41,CONMEBOL|mercato|prestazioni|youth,https://www.marca.com/futbol/mercado-fichajes/2025/08/21/68a6c3d87aeb1c2f7510cc2d-directo.html
2025-09-13,unknown,NOISE_PULSE,"Mundial Sub-20 de fútbol: Messi, Ronaldinho, Saviola",58.7,CONMEBOL|prestazioni|youth,https://www.olympics.com/es/noticias/mundial-sub-20-messi-ronaldinho-saviola-grandes-estrellas
2025-09-13,unknown,TRANSFER_SIGNAL,Los defensas del LA Galaxy Mauricio Cuevas y Marcus ...,52.4,mercato|prestazioni|youth,https://www.lagalaxy.com/news/los-defensas-del-la-galaxy-mauricio-cuevas-y-marcus-ferkranus-han-sido-convocado
2025-09-13,unknown,TRANSFER_SIGNAL,Fulham y Sunderland lideran un agitado cierre del negocio ...,48.12,mercato|prestazioni|recente|youth,https://www.fotmob.com/it/news/qiw1vn06kpmb1aqlyj0z45cp8_es-fulham-y-sunderland-lideran-un-agitado-cierre-del-negocio-de-la-premier-league
2025-09-13,unknown,TRANSFER_SIGNAL,Fichaje de Divin Mubama: Manchester City U21 a Stoke City,21.7,mercato|prestazioni|youth,https://www.transferfeed.com/es/fichajes/divin-mubama-manchester-city-u21-stoke-city/12361703
2025-09-13,unknown,PLAYER_BURST,los jugadores a seguir el torneo africano Sub-20,20.95,esordio|mercato|prestazioni|youth,https://as.com/futbol/internacional/de-el-hannach-a-mustapha-los-jugadores-a-seguir-el-torneo-africano-sub-20-n/
2025-09-13,unknown,NOISE_PULSE,¿Por qué Désiré Doué no juega el Mundial Sub-20 con ...,20.9,segnali,https://www.si.com/es-us/futbol/por-que-desire-doue-no-juega-el-mundial-sub-20-con-francia
2025-09-13,south-america,PLAYER_BURST,Colombia debutó con victoria sobre Israel en el Mundial de ...,13.4,esordio|prestazioni|south-america,https://olimpicocol.co/web/colombia-debuto-con-victoria-sobre-israel-en-el-mundial-de-futbol-sub20/
2025-09-13,unknown,TRANSFER_SIGNAL,SECCION II - JUGADORES - Confederacin Paraguaya de ...,12.1,mercato,https://websites.mygameday.app/assoc_page.cgi?c=0-3374-0-0-0&sID=91326
